{
  "evaluationId": "eval-2026-02-11-020411",
  "promptHash": "sha256:e213951a4fd7f051c2cb6f4f89f309ece069ac581cd5cdf65c48e78840246863",
  "captures": [
    {
      "captureId": "canonical-solarizedDark-previewOnly",
      "imageHash": "sha256:de181938f675030bf5db24fc17878206a8deec63045b560bed8d8b28677d7b0c"
    },
    {
      "captureId": "canonical-solarizedLight-previewOnly",
      "imageHash": "sha256:c469b9a73a28d8d6526e70b7c274e1643bf93e8b759dcae1eedd74679199ffeb"
    },
    {
      "captureId": "geometry-calibration-solarizedDark-previewOnly",
      "imageHash": "sha256:ba923d83af7c7492ceb65f0ac5b10863e52c5da774bca385c6d2c39b5d817812"
    },
    {
      "captureId": "geometry-calibration-solarizedLight-previewOnly",
      "imageHash": "sha256:55067cdfd170c2eed8bff1560acada3d2da5fd553bd7b10cb3219342e025a6f9"
    },
    {
      "captureId": "mermaid-focus-solarizedDark-previewOnly",
      "imageHash": "sha256:6cc2c07273d76eb5505d84de59a21f75d2ef28a45c102c65a4539434be083628"
    },
    {
      "captureId": "mermaid-focus-solarizedLight-previewOnly",
      "imageHash": "sha256:f39f50c83a1d9f49832ce32637c547a6f17e2674d23f96ff9a90ae3b3d631f6d"
    },
    {
      "captureId": "theme-tokens-solarizedDark-previewOnly",
      "imageHash": "sha256:44b3087ea27c79e9dce6100b149875455ee4714c092ebdfa9ef1cf5e83fde990"
    },
    {
      "captureId": "theme-tokens-solarizedLight-previewOnly",
      "imageHash": "sha256:f6d7ccb700156da2431b8f76292f186678af9236bc6cb8c14bd4cb836378f326"
    }
  ],
  "issues": [
    {
      "issueId": "ISS-001",
      "captureId": "canonical-solarizedDark-previewOnly",
      "prdReference": "spatial-design-language FR-3",
      "specificationExcerpt": "headingSpaceAbove (H1) = 48pt (generous). Large space above signals new major section.",
      "observation": "The H1 heading 'Heading Level 1' appears to have approximately 32pt of space above it from the top of the visible content area, rather than the specified 48pt generous spacing.",
      "deviation": "H1 space above appears to be closer to spacious (32pt) rather than generous (48pt). However, this may be conflated with the windowTopInset (32pt) which is a separate constant. If the window top inset is 32pt and H1 headingSpaceAbove is additive, the total would be 80pt which appears roughly correct for the combined distance from the window edge. The H1 may actually be at the very top of the document where headingSpaceAbove for the first element could be collapsed.",
      "severity": "minor",
      "confidence": "low",
      "suggestedAssertion": {
        "type": "spatial",
        "metric": "h1SpaceAbove",
        "expected": 48,
        "tolerance": 8
      }
    },
    {
      "issueId": "ISS-002",
      "captureId": "canonical-solarizedDark-previewOnly",
      "prdReference": "spatial-design-language FR-3",
      "specificationExcerpt": "headingSpaceAbove (H2) = 32pt (spacious). headingSpaceBelow (H2) = 12pt (cozy).",
      "observation": "The space above H2 'Heading Level 2' appears to be less than 32pt. Visually the gap between H1 and H2 appears closer to 20-24pt, which would mean the combined H1 spaceBelow (16pt) and H2 spaceAbove (32pt) should total ~48pt but appears smaller.",
      "deviation": "The inter-heading spacing between H1 and H2 appears compressed relative to the specification. The combined headingSpaceBelow(H1)=16pt + headingSpaceAbove(H2)=32pt should yield a 48pt gap, but the visual gap appears to be approximately 24-32pt.",
      "severity": "minor",
      "confidence": "medium",
      "suggestedAssertion": {
        "type": "spatial",
        "metric": "h2SpaceAbove",
        "expected": 32,
        "tolerance": 4
      }
    },
    {
      "issueId": "ISS-003",
      "captureId": "canonical-solarizedDark-previewOnly",
      "prdReference": "spatial-design-language FR-3",
      "specificationExcerpt": "headingSpaceAbove (H3) = 24pt (relaxed). headingSpaceBelow (H3) = 8pt (compact).",
      "observation": "The vertical gaps between H3, H4, H5, and H6 headings appear approximately uniform and relatively tight — roughly 16-20pt between each successive heading pair.",
      "deviation": "The spacing between lower-level headings (H3-H6) does not clearly reflect the specified hierarchy where H3 spaceAbove = 24pt (relaxed). The gaps between H3/H4/H5/H6 appear too similar, making it difficult to perceive the heading hierarchy through spatial rhythm alone. The specification does not define spacing for H4-H6 explicitly, but the visual impression is that these headings are somewhat compressed together.",
      "severity": "minor",
      "confidence": "medium",
      "suggestedAssertion": {
        "type": "spatial",
        "metric": "h3SpaceAbove",
        "expected": 24,
        "tolerance": 4
      }
    },
    {
      "issueId": "ISS-004",
      "captureId": "canonical-solarizedDark-previewOnly",
      "prdReference": "spatial-design-language FR-4",
      "specificationExcerpt": "componentPadding = 12pt (cozy). Internal padding for code blocks, blockquotes.",
      "observation": "The code block in the dark theme shows a small blue square element in the bottom-right corner of the code block area.",
      "deviation": "There is a small blue square artifact visible at the bottom-right of the code block. This appears to be a scroll indicator or UI element that is visible when it should likely be hidden or styled to match the code block theme. This is a minor visual artifact that does not significantly impact readability.",
      "severity": "minor",
      "confidence": "high"
    },
    {
      "issueId": "ISS-005",
      "captureId": "canonical-solarizedLight-previewOnly",
      "prdReference": "spatial-design-language FR-3",
      "specificationExcerpt": "headingSpaceAbove (H2) = 32pt (spacious). headingSpaceBelow (H2) = 12pt (cozy).",
      "observation": "Same as dark theme: the space above H2 in the light theme appears compressed relative to the specified 32pt spacious spacing.",
      "deviation": "The inter-heading spacing between H1 and H2 appears compressed in the light theme as well, consistent with the dark theme observation. The combined gap appears to be approximately 24-32pt rather than the expected ~48pt (H1 below + H2 above).",
      "severity": "minor",
      "confidence": "medium",
      "suggestedAssertion": {
        "type": "spatial",
        "metric": "h2SpaceAbove",
        "expected": 32,
        "tolerance": 4
      }
    },
    {
      "issueId": "ISS-006",
      "captureId": "canonical-solarizedLight-previewOnly",
      "prdReference": "spatial-design-language FR-4",
      "specificationExcerpt": "componentPadding = 12pt (cozy). Internal padding for code blocks, blockquotes.",
      "observation": "Same blue square artifact visible in the bottom-right corner of the code block in the light theme.",
      "deviation": "The same small blue square artifact visible in the dark theme also appears in the light theme code block. This is a UI element (likely a resize handle or scroll indicator) that is visible when it probably should be hidden or themed appropriately.",
      "severity": "minor",
      "confidence": "high"
    },
    {
      "issueId": "ISS-001",
      "captureId": "geometry-calibration-solarizedDark-previewOnly",
      "prdReference": "spatial-design-language FR-3",
      "specificationExcerpt": "headingSpaceAbove (H2): 32pt (spacious) — Proportional reduction from H1; still clearly a section break",
      "observation": "The space above H2 'Calibration Heading Two' appears to be approximately 24pt rather than the specified 32pt. The gap between the last paragraph under H1 and the H2 heading looks closer to 'relaxed' (24pt) than 'spacious' (32pt).",
      "deviation": "Space above H2 appears approximately 8pt less than specified. Expected 32pt (spacious), observed approximately 24pt (relaxed).",
      "severity": "minor",
      "confidence": "medium",
      "suggestedAssertion": {
        "type": "spatial",
        "metric": "h2SpaceAbove",
        "expected": 32,
        "tolerance": 4
      }
    },
    {
      "issueId": "ISS-002",
      "captureId": "geometry-calibration-solarizedLight-previewOnly",
      "prdReference": "spatial-design-language FR-3",
      "specificationExcerpt": "headingSpaceAbove (H2): 32pt (spacious) — Proportional reduction from H1; still clearly a section break",
      "observation": "Same as dark theme: the space above H2 'Calibration Heading Two' appears to be approximately 24pt rather than the specified 32pt.",
      "deviation": "Space above H2 appears approximately 8pt less than specified. Expected 32pt (spacious), observed approximately 24pt (relaxed). Consistent with dark theme, indicating this is a code-level issue rather than theme-specific.",
      "severity": "minor",
      "confidence": "medium",
      "suggestedAssertion": {
        "type": "spatial",
        "metric": "h2SpaceAbove",
        "expected": 32,
        "tolerance": 4
      }
    },
    {
      "issueId": "ISS-003",
      "captureId": "geometry-calibration-solarizedDark-previewOnly",
      "prdReference": "spatial-design-language FR-3",
      "specificationExcerpt": "headingSpaceBelow (H3): 8pt (compact) — Tight binding; H3 is closely coupled to its content",
      "observation": "The space below H3 'Calibration Heading Three' to its following paragraph appears slightly larger than the specified 8pt compact spacing. It looks closer to 12pt (cozy).",
      "deviation": "Space below H3 appears approximately 4pt more than specified. Expected 8pt (compact), observed approximately 12pt (cozy). The binding between H3 and its content is not as tight as the specification intends.",
      "severity": "minor",
      "confidence": "low",
      "suggestedAssertion": {
        "type": "spatial",
        "metric": "h3SpaceBelow",
        "expected": 8,
        "tolerance": 2
      }
    },
    {
      "issueId": "ISS-004",
      "captureId": "geometry-calibration-solarizedLight-previewOnly",